{
  "template_id": "P3-T01",
  "family": "P3",
  "kazanim_kodu": "MAT.9.4.4",
  "baslik": "Dik üçgende üçüncü kenarın uzunluğu",
  "aciklama": "H1'in kanonik şablonu: öğrenci dikliği çizimden varsayıp Pisagor'a geçer. H3 varyantında koşulu hiç anmadan doğrudan uygular.",
  "parametreler": {
    "V": {
      "tip": "vertex_triple"
    },
    "a": {
      "tip": "int",
      "min": 3,
      "max": 12
    },
    "b": {
      "tip": "int",
      "min": 4,
      "max": 15
    }
  },
  "kisitlar": [
    "a != b"
  ],
  "figure_base": {
    "points": [
      "{V0}",
      "{V1}",
      "{V2}"
    ],
    "segments": [
      {
        "from": "{V0}",
        "to": "{V1}",
        "type": "side",
        "length": "{a}"
      },
      {
        "from": "{V1}",
        "to": "{V2}",
        "type": "side",
        "length": "{b}"
      },
      {
        "from": "{V0}",
        "to": "{V2}",
        "type": "side",
        "length": null
      }
    ],
    "angles": [],
    "perpendicular": [
      "{V1}"
    ],
    "congruent_segments": [],
    "similar": []
  },
  "varyantlar": [
    {
      "sinif": "H0",
      "hatali_adim": null,
      "bias": "neutral",
      "soru": "{V0}{V1}{V2} üçgeninde m({V1}) = 90°, |{V0}{V1}| = {a} br ve |{V1}{V2}| = {b} br olarak verilmiştir. |{V0}{V2}| kaç birimdir?",
      "steps": [
        {
          "id": "s1",
          "claim": "|{V0}{V2}|^2 = {a}^2 + {b}^2",
          "rule": "pisagor",
          "depends_on": []
        }
      ],
      "not": "Diklik figure.perpendicular içinde verilmiştir; Pisagor'un ön koşulu sağlanıyor."
    },
    {
      "sinif": "H1",
      "hatali_adim": "s1",
      "bias": "misleading",
      "soru": "{V0}{V1}{V2} üçgeninde |{V0}{V1}| = {a} br ve |{V1}{V2}| = {b} br olarak verilmiştir. |{V0}{V2}| kaç birimdir?",
      "figure_override": {
        "perpendicular": []
      },
      "steps": [
        {
          "id": "s1",
          "claim": "m({V1}) = 90",
          "rule": "verilen",
          "depends_on": []
        },
        {
          "id": "s2",
          "claim": "|{V0}{V2}|^2 = {a}^2 + {b}^2",
          "rule": "pisagor",
          "depends_on": [
            "s1"
          ]
        }
      ],
      "not": "figure.perpendicular boş; öğrenci dikliği 'verilen' diye iddia etti. Taksonomi §4.2 gereği H1.",
      "cizim_ipucu": {
        "tip": "dik_aci",
        "kose": "{V1}"
      }
    },
    {
      "sinif": "H3",
      "hatali_adim": "s1",
      "bias": "neutral",
      "soru": "{V0}{V1}{V2} üçgeninde |{V0}{V1}| = {a} br ve |{V1}{V2}| = {b} br olarak verilmiştir. |{V0}{V2}| kaç birimdir?",
      "figure_override": {
        "perpendicular": []
      },
      "steps": [
        {
          "id": "s1",
          "claim": "|{V0}{V2}|^2 = {a}^2 + {b}^2",
          "rule": "pisagor",
          "depends_on": []
        }
      ],
      "not": "Diklik yok ve öğrenci onu hiç anmadı; ön koşul denetlenmeden teorem uygulandı. Taksonomi §4.2 gereği H3."
    }
  ]
}
