{
  "template_id": "P5-T02",
  "family": "P5",
  "kazanim_kodu": "MAT.10.1.2",
  "baslik": "Yardımcı elemanlar: açıortay ve kenarortay ayrımı",
  "aciklama": "Açıortay AÇIYI ikiye böler, kenarı değil. Kenarortay KENARI ikiye böler, açıyı değil. Bu ikisinin karıştırılması H2'nin ikinci kanonik biçimidir. H2'yi P5-T01'den bağımsız ikinci bir kaynaktan besler.",
  "parametreler": {
    "V": {
      "tip": "vertex_triple"
    },
    "a": {
      "tip": "int",
      "min": 40,
      "max": 96,
      "adim": 4
    },
    "m": {
      "tip": "int",
      "min": 10,
      "max": 26,
      "adim": 2
    }
  },
  "kisitlar": [],
  "figure_base": {
    "points": [
      "{V0}",
      "{V1}",
      "{V2}",
      "D"
    ],
    "segments": [
      {
        "from": "{V1}",
        "to": "{V2}",
        "type": "side",
        "length": "{m}"
      },
      {
        "from": "{V0}",
        "to": "{V1}",
        "type": "side",
        "length": null
      },
      {
        "from": "{V0}",
        "to": "{V2}",
        "type": "side",
        "length": null
      },
      {
        "from": "{V0}",
        "to": "D",
        "type": "bisector",
        "length": null
      }
    ],
    "angles": [
      {
        "vertex": "{V0}",
        "value": "{a}"
      },
      {
        "vertex": "{V1}",
        "value": null
      },
      {
        "vertex": "{V2}",
        "value": null
      }
    ],
    "perpendicular": [],
    "congruent_segments": [],
    "similar": []
  },
  "varyantlar": [
    {
      "sinif": "H0",
      "hatali_adim": null,
      "bias": "neutral",
      "soru": "{V0}{V1}{V2} üçgeninde [{V0}D] açıortaydır ve m({V0}) = {a}° verilmiştir. m({V1}{V0}D) kaç derecedir?",
      "steps": [
        {
          "id": "s1",
          "claim": "m({V1}{V0}D) = {a}/2",
          "rule": "aciortay",
          "depends_on": [],
          "refs": {
            "segment": "{V0}D"
          }
        }
      ],
      "not": "Segment tipi 'bisector'; aciortay teoreminin ön koşulu sağlanıyor."
    },
    {
      "sinif": "H2",
      "hatali_adim": "s1",
      "bias": "misleading",
      "soru": "{V0}{V1}{V2} üçgeninde [{V0}D] açıortaydır, m({V0}) = {a}° ve |{V1}{V2}| = {m} br'dir. |{V1}D| kaç birimdir?",
      "steps": [
        {
          "id": "s1",
          "claim": "|{V1}D| = |D{V2}| = {m}/2",
          "rule": "kenarortay",
          "depends_on": [],
          "refs": {
            "segment": "{V0}D"
          }
        }
      ],
      "not": "kenarortay teoremi type=='median' gerektirir; [{V0}D] ise 'bisector'. Açıortay açıyı böler, kenarı değil → taksonomi §4.3 gereği H2.",
      "cizim_ipucu": {
        "tip": "ikizkenar",
        "tepe": "{V0}"
      }
    },
    {
      "sinif": "H3",
      "hatali_adim": "s2",
      "bias": "neutral",
      "soru": "{V0}{V1}{V2} üçgeninde [{V0}D] açıortaydır ve m({V0}) = {a}° verilmiştir. m({V1}) kaç derecedir?",
      "steps": [
        {
          "id": "s1",
          "claim": "m({V1}{V0}D) = {a}/2",
          "rule": "aciortay",
          "depends_on": [],
          "refs": {
            "segment": "{V0}D"
          }
        },
        {
          "id": "s2",
          "claim": "m({V1}) = m({V2}) = (180 - {a})/2",
          "rule": "ikizkenar_taban",
          "depends_on": [
            "s1"
          ]
        }
      ],
      "not": "congruent_segments boş; üçgenin ikizkenar olduğu verilmedi. Açıortay olması ikizkenarlık anlamına gelmez. Öğrenci koşulu hiç anmadan taban açıları özelliğini uyguladı → H3."
    }
  ]
}
