{
  "template_id": "P5-T01",
  "family": "P5",
  "kazanim_kodu": null,
  "baslik": "Yardımcı elemanlar: yükseklik ve kenarortay ayrımı",
  "aciklama": "H2'nin kanonik şablonu: yükseklik ayağı H ile kenar orta noktası M karıştırılır. Bu iki nokta yalnızca ikizkenar üçgende çakışır.",

  "parametreler": {
    "V": { "tip": "vertex_triple" },
    "m": { "tip": "int", "min": 8, "max": 24, "adim": 2 }
  },
  "kisitlar": [],

  "figure_base": {
    "points": ["{V0}", "{V1}", "{V2}", "H"],
    "segments": [
      { "from": "{V1}", "to": "{V2}", "type": "side", "length": "{m}" },
      { "from": "{V0}", "to": "{V1}", "type": "side", "length": null },
      { "from": "{V0}", "to": "{V2}", "type": "side", "length": null },
      { "from": "{V0}", "to": "H", "type": "altitude", "length": null }
    ],
    "angles": [],
    "perpendicular": [],
    "congruent_segments": [],
    "similar": []
  },

  "varyantlar": [
    {
      "sinif": "H0",
      "hatali_adim": null,
      "bias": "neutral",
      "soru": "{V0}{V1}{V2} üçgeninde [{V0}H] yüksekliktir ve |{V1}{V2}| = {m} br'dir. m({V0}H{V1}) kaç derecedir?",
      "steps": [
        {
          "id": "s1",
          "claim": "m({V0}H{V1}) = 90",
          "rule": "yukseklik",
          "depends_on": []
        }
      ],
      "not": "Segment tipi 'altitude'; yukseklik teoreminin ön koşulu sağlanıyor."
    },
    {
      "sinif": "H2",
      "hatali_adim": "s1",
      "bias": "misleading",
      "soru": "{V0}{V1}{V2} üçgeninde [{V0}H] yüksekliktir ve |{V1}{V2}| = {m} br'dir. |{V1}H| kaç birimdir?",
      "steps": [
        {
          "id": "s1",
          "claim": "|{V1}H| = |H{V2}| = {m}/2",
          "rule": "kenarortay",
          "depends_on": []
        }
      ],
      "not": "kenarortay teoremi type=='median' gerektirir; [{V0}H] ise 'altitude'. Kenar tipi yanlış eşleştirilmiş → taksonomi §4.3 gereği H2."
    },
    {
      "sinif": "H1",
      "hatali_adim": "s1",
      "bias": "misleading",
      "soru": "{V0}{V1}{V2} üçgeninde [{V0}H] yüksekliktir ve |{V1}{V2}| = {m} br'dir. |{V1}H| kaç birimdir?",
      "steps": [
        {
          "id": "s1",
          "claim": "|{V0}{V1}| = |{V0}{V2}|",
          "rule": "verilen",
          "depends_on": []
        },
        {
          "id": "s2",
          "claim": "|{V1}H| = |H{V2}| = {m}/2",
          "rule": "ikizkenar_taban",
          "depends_on": ["s1"]
        }
      ],
      "not": "figure.congruent_segments boş; öğrenci üçgeni çizime bakarak ikizkenar varsayıp 'verilen' diye iddia etti → H1. İkizkenar olsaydı H ile orta nokta çakışır ve sonuç doğru olurdu."
    }
  ]
}
